name,body_group,force,muscle_group,equipment,description,steps,grip,video_link
Standing Forward Bend,Lower Body,Hold,Legs,Yoga,"Stand with your feet hip-width apart., Hinge forward at your hips, reaching your hands towards the ground., Allow your head to hang heavy and feel a stretch in the back of your legs., Hold for a few breaths and then slowly roll up to a standing position.","Stand with your feet hip-width apart., Hinge forward at your hips, reaching your hands towards the ground., Allow your head to hang heavy and feel a stretch in the back of your legs., Hold for a few breaths and then slowly roll up to a standing position.",N/A,"https://media.musclewiki.com/media/uploads/videos/branded/male-yoga-standing-forward-bend-front.mp4#t=0.1, https://media.musclewiki.com/media/uploads/videos/branded/male-yoga-standing-forward-bend-side.mp4#t=0.1"
Standing Forward Bend Blocks,Lower Body,Hold,Legs,Yoga,"Stand with your feet hip-width apart and place a block on the ground in front of you., Hinge forward at your hips and place your hands on the block., Allow your head to hang heavy and feel a stretch in the back of your legs., Hold for a few breaths and then slowly roll up to a standing position.","Stand with your feet hip-width apart and place a block on the ground in front of you., Hinge forward at your hips and place your hands on the block., Allow your head to hang heavy and feel a stretch in the back of your legs., Hold for a few breaths and then slowly roll up to a standing position.",N/A,"https://media.musclewiki.com/media/uploads/videos/branded/male-yoga-standing-forward-bend-blocks-front.mp4#t=0.1, https://media.musclewiki.com/media/uploads/videos/branded/male-yoga-standing-forward-bend-blocks-side.mp4#t=0.1"
Warrior Three,Lower Body,Hold,Legs,Yoga,"Start in mountain pose, standing with your feet hip-width apart and arms at your sides., Step your left foot back about 3-4 feet and raise it off the ground, while keeping your right foot facing forward., Inhale and reach your arms forward, parallel to the ground., Exhale and hinge forward at your hips, bringing your torso parallel to the ground and extending your left leg straight back. Keep your arms and right leg straight and hold the pose for a few breaths, inhale and return to mountain pose. Repeat on the other side.","Start in mountain pose, standing with your feet hip-width apart and arms at your sides., Step your left foot back about 3-4 feet and raise it off the ground, while keeping your right foot facing forward., Inhale and reach your arms forward, parallel to the ground., Exhale and hinge forward at your hips, bringing your torso parallel to the ground and extending your left leg straight back. Keep your arms and right leg straight and hold the pose for a few breaths, inhale and return to mountain pose. Repeat on the other side.",N/A,"https://media.musclewiki.com/media/uploads/videos/branded/male-yoga-warrior-three-front.mp4#t=0.1, https://media.musclewiki.com/media/uploads/videos/branded/male-yoga-warrior-three-side.mp4#t=0.1"
Wide Legged Standing Forward Bend Holding Heels,Lower Body,Hold,Legs,Yoga,"Start standing at the top of your mat with your feet wide apart., Start standing at the top of your mat with your feet wide apart., Exhale and fold forward from your hips, bringing your hands up and over your head towards the ground., Hold for a few breaths and then release the hands and come back up to standing.","Start standing at the top of your mat with your feet wide apart., Start standing at the top of your mat with your feet wide apart., Exhale and fold forward from your hips, bringing your hands up and over your head towards the ground., Hold for a few breaths and then release the hands and come back up to standing.",N/A,"https://media.musclewiki.com/media/uploads/videos/branded/male-yoga-wide-legged-standing-forward-bend-holding-heels-front.mp4#t=0.1, https://media.musclewiki.com/media/uploads/videos/branded/male-yoga-wide-legged-standing-forward-bend-holding-heels-side.mp4#t=0.1"
Glute Bridge,Lower Body,Unknown,Glutes,Bodyweight,"Lie down with your knees bent and your feet flat on the floor., Push your hips up so that your butt is elevated and your back straight., Tense your glutes and raise your hips towards the ceiling., Once you are at the highest point you can manage, hold the position for a few seconds, and then slowly return to the starting position","Lie down with your knees bent and your feet flat on the floor., Push your hips up so that your butt is elevated and your back straight., Tense your glutes and raise your hips towards the ceiling., Once you are at the highest point you can manage, hold the position for a few seconds, and then slowly return to the starting position",N/A,"https://media.musclewiki.com/media/uploads/videos/branded/male-bodyweight-glute-bridge-front.mp4#t=0.1, https://media.musclewiki.com/media/uploads/videos/branded/male-bodyweight-glute-bridge-side.mp4#t=0.1"
Barbell Hip Thrust,Lower Body,Push,Glutes,Barbell,"Barbell Hip thrust Detailed How To:SetupGrab a box, (or a bench) that is roughly 18 to 24 inches in height. Grab some type of pad to go between your hips and the barbell. Getting the bar into place can be challenging depending on what you have access to. If you've got access to a weighted barbell like in our demo video, either place the bar on your hips while seated on the box or bench and slide down until your shoulder blades are at the edge of the box. Or, slide into position, with the bar standing vertically next to you, then carefully tip the bar over you and onto your hips. If you have plates that roll on the bar, it becomes a lot easier. In that instance, just roll the bar into place over your hips. If you have the 12 sided plates (most gyms will have these), it's a lot more challenging. You'll have to get the bar as close to straight over your hips as you can and then scoot into position. Once you have the bar in place on your hip bones, take your stance. Your feet should be about shoulder width apart, and toes facing forward. You don't want your feet too far forward or back. If your feet are too far forward, it will shorten the range of motion. If your feet are too far back you will turn the hip thrust into more of a quadricep movement. Once you have your stance, grab the bar with either a double overhand or mixed grip. Your hands should only be keeping the bar in place as you perform the movement. Make sure your shoulder blades are pulled back and dug into the box. Now we initiate the hip thrust.Performing The Barbell Hip thrustForce your hips as high as you can. Hip Thrust variations do something no other glute movements do. The tension is at its highest at the top of the movement when the glutes are in their contracted or shortened position. Therefore, the most important part of the hip thrust is the very top end of the range of motion. You will know you're in the right spot when you feel your glutes contract really hard.There is no need to touch your butt or the plates all the way back to the floor on each rep. Just go as low as you can without touching the plates back down to the floor. This will keep tension on your glutes.","Sit on the ground with a bench behind you. Have the barbell over your legs just above your hips., Lean back against the bench so that your shoulders are resting upon it, stretch your arms out to either side using the bench as support., Raise the weight by driving through your feet and extending your hips upwards. Support the weight with your shoulders and feet., Slowly extend as far as you can, and then slowly return to the starting position.",Overhand Underhand Mixed,"https://media.musclewiki.com/media/uploads/videos/branded/male-barbell-hip-thrust-front.mp4#t=0.1, https://media.musclewiki.com/media/uploads/videos/branded/male-barbell-hip-thrust-side.mp4#t=0.1"
Single Leg Glute Bridge,Lower Body,Unknown,Glutes,Bodyweight,"Lie down with one knee bent and and one with a slight bend., Push your hips up, so that your butt is elevated and your back straight., Tense your glutes and raise your hips towards the ceiling., Once you are at the highest point you can manage, hold the position for a few seconds, and then slowly return to the starting position.","Lie down with one knee bent and and one with a slight bend., Push your hips up, so that your butt is elevated and your back straight., Tense your glutes and raise your hips towards the ceiling., Once you are at the highest point you can manage, hold the position for a few seconds, and then slowly return to the starting position.",N/A,"https://media.musclewiki.com/media/uploads/videos/branded/male-bodyweight-single-leg-glute-bridge-front.mp4#t=0.1, https://media.musclewiki.com/media/uploads/videos/branded/male-bodyweight-single-leg-glute-bridge-side.mp4#t=0.1"
Kettlebell Glute Bridge,Lower Body,Unknown,Glutes,Kettlebell,"Laying on the floor with your knees bent and feet firmly on the floor, rest the kettlebell on your pelvis., Pushing through the legs and keeping the core muscles engaged, raise your pelvis off the floor until your stomach, pelvis and thighs make a straight line., Slowly lower to the ground to the starting position and repeat.","Laying on the floor with your knees bent and feet firmly on the floor, rest the kettlebell on your pelvis., Pushing through the legs and keeping the core muscles engaged, raise your pelvis off the floor until your stomach, pelvis and thighs make a straight line., Slowly lower to the ground to the starting position and repeat.",N/A,"https://media.musclewiki.com/media/uploads/videos/branded/male-kettlebell-glute-bridge-front.mp4#t=0.1, https://media.musclewiki.com/media/uploads/videos/branded/male-kettlebell-glute-bridge-side.mp4#t=0.1"
Kettlebell Single Leg Glute Bridge,Lower Body,Unknown,Glutes,Kettlebell,"Laying on the floor with one knee bent with the foot firmly on the floor and one leg extended, rest the kettlebell on your pelvis., Pushing through the bent leg and keeping the core muscles engaged, raise your pelvis and the extended leg off the floor until your stomach, pelvis and thighs make a straight line., Slowly lower to the ground to the starting position and repeat.","Laying on the floor with one knee bent with the foot firmly on the floor and one leg extended, rest the kettlebell on your pelvis., Pushing through the bent leg and keeping the core muscles engaged, raise your pelvis and the extended leg off the floor until your stomach, pelvis and thighs make a straight line., Slowly lower to the ground to the starting position and repeat.",N/A,"https://media.musclewiki.com/media/uploads/videos/branded/male-kettlebell-single-leg-glute-bridge-front.mp4#t=0.1, https://media.musclewiki.com/media/uploads/videos/branded/male-kettlebell-single-leg-glute-bridge-side.mp4#t=0.1"
Kettlebell Hip Thrust,Lower Body,Unknown,Glutes,Kettlebell,"Sitting on the floor with your knees bent and feet planted firmly on the floor, lean your back against the bench., Resting the kettlebell on your pelvis, raise your pelvis until your stomach, pelvis and thighs are in line., Slowly lower until you are in the starting position and repeat.","Sitting on the floor with your knees bent and feet planted firmly on the floor, lean your back against the bench., Resting the kettlebell on your pelvis, raise your pelvis until your stomach, pelvis and thighs are in line., Slowly lower until you are in the starting position and repeat.",N/A,"https://media.musclewiki.com/media/uploads/videos/branded/male-kettlebell-hip-thrust-front.mp4#t=0.1, https://media.musclewiki.com/media/uploads/videos/branded/male-kettlebell-hip-thrust-side.mp4#t=0.1"
Kettlebell Single Leg Hip Thrust,Lower Body,Unknown,Glutes,Kettlebell,"Sitting on the floor with one knee bent with the foot firmly on the floor and one leg extended, lean your back against the bench., Resting the kettlebell on your pelvis, raise your pelvis until your stomach, pelvis and thighs are in line., Slowly lower until you are in the starting position and repeat.","Sitting on the floor with one knee bent with the foot firmly on the floor and one leg extended, lean your back against the bench., Resting the kettlebell on your pelvis, raise your pelvis until your stomach, pelvis and thighs are in line., Slowly lower until you are in the starting position and repeat.",N/A,"https://media.musclewiki.com/media/uploads/videos/branded/male-kettlebell-single-leg-hip-thrust-front.mp4#t=0.1, https://media.musclewiki.com/media/uploads/videos/branded/male-kettlebell-single-leg-hip-thrust-side.mp4#t=0.1"
Glutes Stretch Variation Three,Lower Body,Unknown,Glutes,Stretches,"Lay flat and bring your left leg to 90 degrees., Hold your left leg with both hands and slowly rotate your hips to the right hand side., Hold at the peak of the stretch, then slowly return to starting position., Switch sides and repeat.","Lay flat and bring your left leg to 90 degrees., Hold your left leg with both hands and slowly rotate your hips to the right hand side., Hold at the peak of the stretch, then slowly return to starting position., Switch sides and repeat.",N/A,"https://media.musclewiki.com/media/uploads/videos/branded/male-glutes-stretch-variation-3-front.mp4#t=0.1, https://media.musclewiki.com/media/uploads/videos/branded/male-glutes-stretch-variation-3-side.mp4#t=0.1"
Glutes Stretch Variation Two,Lower Body,Unknown,Glutes,Stretches,"Sit on the ground and lay one leg flat and the other over the top., Hold your leg with the same side arm and slowly rotate your hips and back., Hold at the peak of the stretch, then slowly return to starting position., Switch sides and repeat.","Sit on the ground and lay one leg flat and the other over the top., Hold your leg with the same side arm and slowly rotate your hips and back., Hold at the peak of the stretch, then slowly return to starting position., Switch sides and repeat.",N/A,"https://media.musclewiki.com/media/uploads/videos/branded/male-glutes-stretch-variation-2-front.mp4#t=0.1, https://media.musclewiki.com/media/uploads/videos/branded/male-glutes-stretch-variation-2-side.mp4#t=0.1"
Glutes Stretch Variation One,Lower Body,Unknown,Glutes,Stretches,"On your front, place one leg forward and then stretch out the same side arm across the mat/floor., Fully extend your leg and arm., Hold at the peak of the stretch, then slowly return to starting position., Switch sides and repeat.","On your front, place one leg forward and then stretch out the same side arm across the mat/floor., Fully extend your leg and arm., Hold at the peak of the stretch, then slowly return to starting position., Switch sides and repeat.",N/A,"https://media.musclewiki.com/media/uploads/videos/branded/male-glutes-stretch-variation-1-front.mp4#t=0.1, https://media.musclewiki.com/media/uploads/videos/branded/male-glutes-stretch-variation-1-side.mp4#t=0.1"
Cable Hip Abduction,Lower Body,Unknown,Glutes,Cable,"Use an ankle attachment. Cable should be set all the way to the bottom., Face sideways with the ankle attachment on your outside leg. Walk a few steps away., Abduct at the hips and raise your leg out to the side., Return to the starting position and stop just short of your foot touching back to the ground (to keep tension on the muscle).","Use an ankle attachment. Cable should be set all the way to the bottom., Face sideways with the ankle attachment on your outside leg. Walk a few steps away., Abduct at the hips and raise your leg out to the side., Return to the starting position and stop just short of your foot touching back to the ground (to keep tension on the muscle).",N/A,"https://media.musclewiki.com/media/uploads/videos/branded/male-cable-hip-abduction-front.mp4#t=0.1, https://media.musclewiki.com/media/uploads/videos/branded/male-cable-hip-abduction-side.mp4#t=0.1"
Cable Glute Kickback,Lower Body,Unknown,Glutes,Cable,"Use an ankle attachment. The cable should be set to the bottom of the crossover machine., Push your ankle straight back, extending at the hip. Hold for a one count when you feel a contraction in your glutes., Then flex at the hips until you are back into your original position.","Use an ankle attachment. The cable should be set to the bottom of the crossover machine., Push your ankle straight back, extending at the hip. Hold for a one count when you feel a contraction in your glutes., Then flex at the hips until you are back into your original position.",N/A,"https://media.musclewiki.com/media/uploads/videos/branded/male-cable-glute-kickbacks-front.mp4#t=0.1, https://media.musclewiki.com/media/uploads/videos/branded/male-cable-glute-kickbacks-side.mp4#t=0.1"
Band Glute Kickback,Lower Body,Unknown,Glutes,Band,"Get into a quadruped position. Loop the band around both of your wrists and one of your feet., Extend your knee and hip straight back until you feel like contraction in the glutes., Flex at the knee until back in the starting position.","Get into a quadruped position. Loop the band around both of your wrists and one of your feet., Extend your knee and hip straight back until you feel like contraction in the glutes., Flex at the knee until back in the starting position.",N/A,"https://media.musclewiki.com/media/uploads/videos/branded/male-band-kickback-front.mp4#t=0.1, https://media.musclewiki.com/media/uploads/videos/branded/male-band-kickback-side.mp4#t=0.1"
Dumbbell Hip Thrust,Lower Body,Unknown,Glutes,Dumbbell,"Place your shoulder blades against a box or bench that wont move., Both your feet should be planted and your heels should not come off the floor. Point your toes forward., Break at the hips. Seek the longest range of motion possible. Focus on the top end of the movement. Push your hips as high as possible on each rep.","Place your shoulder blades against a box or bench that wont move., Both your feet should be planted and your heels should not come off the floor. Point your toes forward., Break at the hips. Seek the longest range of motion possible. Focus on the top end of the movement. Push your hips as high as possible on each rep.",N/A,"https://media.musclewiki.com/media/uploads/videos/branded/male-dumbbell-hip-thrust-front.mp4#t=0.1, https://media.musclewiki.com/media/uploads/videos/branded/male-dumbbell-hip-thrust-side.mp4#t=0.1"
Barbell Glute Bridge,Lower Body,Push,Glutes,Barbell,"Lie on your back on the floor with your knees bent and your feet flat on the ground. Place a barbell across your hips and grasp it with both hands., Keeping your arms straight, push through your heels to lift your hips off the ground and raise the barbell., Hold the bridge position for a moment, then slowly lower your hips back to the starting position.","Lie on your back on the floor with your knees bent and your feet flat on the ground. Place a barbell across your hips and grasp it with both hands., Keeping your arms straight, push through your heels to lift your hips off the ground and raise the barbell., Hold the bridge position for a moment, then slowly lower your hips back to the starting position.",Overhand Mixed,"https://media.musclewiki.com/media/uploads/videos/branded/male-barbell-glute-bridge-front.mp4#t=0.1, https://media.musclewiki.com/media/uploads/videos/branded/male-barbell-glute-bridge-side.mp4#t=0.1"
Dumbbell Figure Four Glute Bridge,Lower Body,Push,Glutes,Dumbbell,"Lay flat on the ground with one leg crossed over the other and your heel planted on the ground., Push your hips toward the ceiling and hold for a second.","Lay flat on the ground with one leg crossed over the other and your heel planted on the ground., Push your hips toward the ceiling and hold for a second.",N/A,"https://media.musclewiki.com/media/uploads/videos/branded/male-dumbbell-figure-four-glute-bridge-front.mp4#t=0.1, https://media.musclewiki.com/media/uploads/videos/branded/male-dumbbell-figure-four-glute-bridge-side.mp4#t=0.1"
Dumbbell Figure Four Hip Thrust,Lower Body,Push,Glutes,Dumbbell,"Put your shoulder blades on a bench and cross one leg over the other., Start with your hips up., Drop your hips and then push your hips up toward the ceiling.","Put your shoulder blades on a bench and cross one leg over the other., Start with your hips up., Drop your hips and then push your hips up toward the ceiling.",N/A,"https://media.musclewiki.com/media/uploads/videos/branded/male-dumbbell-figure-four-hip-thrust-front.mp4#t=0.1, https://media.musclewiki.com/media/uploads/videos/branded/male-dumbbell-figure-four-hip-thrust-side.mp4#t=0.1"
Dumbbell Single Leg Glute Bridge,Lower Body,Push,Glutes,Dumbbell,"Start by lying on your back with your feet flat on the ground and a dumbbell on your hips., Lift one leg off the ground and engage your glutes to raise your hips up towards the ceiling., From this starting position, slowly lower your hips back down to the starting position.","Start by lying on your back with your feet flat on the ground and a dumbbell on your hips., Lift one leg off the ground and engage your glutes to raise your hips up towards the ceiling., From this starting position, slowly lower your hips back down to the starting position.",Overhand Neutral,"https://media.musclewiki.com/media/uploads/videos/branded/male-dumbbell-single-leg-glute-bridge-front.mp4#t=0.1, https://media.musclewiki.com/media/uploads/videos/branded/male-dumbbell-single-leg-glute-bridge-side.mp4#t=0.1"
Dumbbell Single Leg Hip Thrust,Lower Body,Push,Glutes,Dumbbell,"Start by lying on a bench with your feet flat on the ground and a dumbbell on your hips., Lift one leg off the ground and engage your glutes to raise your hips up towards the ceiling., From this starting position, slowly lower your hips back down to the starting position.","Start by lying on a bench with your feet flat on the ground and a dumbbell on your hips., Lift one leg off the ground and engage your glutes to raise your hips up towards the ceiling., From this starting position, slowly lower your hips back down to the starting position.",Overhand Neutral,"https://media.musclewiki.com/media/uploads/videos/branded/male-dumbbell-single-leg-hip-thrust-front.mp4#t=0.1, https://media.musclewiki.com/media/uploads/videos/branded/male-dumbbell-single-leg-hip-thrust-side.mp4#t=0.1"
Dumbbell Staggered Glute Bridge,Lower Body,Push,Glutes,Dumbbell,"Start by lying on your back with your feet on the ground and a dumbbell in each hand., Place one foot on the ground and the other slightly in front, with your knees bent., From this starting position, raise your hips up off the ground by pushing through your heels and squeezing your glutes.","Start by lying on your back with your feet on the ground and a dumbbell in each hand., Place one foot on the ground and the other slightly in front, with your knees bent., From this starting position, raise your hips up off the ground by pushing through your heels and squeezing your glutes.",Overhand Neutral,"https://media.musclewiki.com/media/uploads/videos/branded/male-dumbbell-staggered-glute-bridge-front.mp4#t=0.1, https://media.musclewiki.com/media/uploads/videos/branded/male-dumbbell-staggered-glute-bridge-side.mp4#t=0.1"
Dumbbell Staggered Hip thrust,Lower Body,Push,Glutes,Dumbbell,"Start by lying on your back on a bench with your feet on the ground and a dumbbell on your hips., Place one foot on the ground and the other slightly in front, with your knees bent., From this starting position, raise your hips up off the ground by pushing through your heels and squeezing your glutes.","Start by lying on your back on a bench with your feet on the ground and a dumbbell on your hips., Place one foot on the ground and the other slightly in front, with your knees bent., From this starting position, raise your hips up off the ground by pushing through your heels and squeezing your glutes.",Overhand Neutral,"https://media.musclewiki.com/media/uploads/videos/branded/male-dumbbell-staggered-hip-thrust-front.mp4#t=0.1, https://media.musclewiki.com/media/uploads/videos/branded/male-dumbbell-staggered-hip-thrust-side.mp4#t=0.1"
Plate Clean,Lower Body,Unknown,Glutes,Plate,"Stand with feet shoulder-width apart and the plate in front of the feet., Bend the knees and hips to pick up the plate, keeping the back straight and core engaged., Stand up while pulling the plate towards the chest., Keep shoulder level while keeping the elbows high and in front of the plate.","Stand with feet shoulder-width apart and the plate in front of the feet., Bend the knees and hips to pick up the plate, keeping the back straight and core engaged., Stand up while pulling the plate towards the chest., Keep shoulder level while keeping the elbows high and in front of the plate.",Neutral,"https://media.musclewiki.com/media/uploads/videos/branded/male-plate-clean-front.mp4#t=0.1, https://media.musclewiki.com/media/uploads/videos/branded/male-plate-clean-side.mp4#t=0.1"
Band Hip Abduction,Lower Body,Push,Glutes,Band,"Attach the band around your ankle. Stand with feet hip-width apart, feet facing forward, and hands on hips., Lift your right leg away from your body to the side, keeping your knee straight. This is your starting position., Maintaining proper form, move your right leg as far to the side as you can, keeping your left leg planted firmly on the ground. Hold for a second and then return your right leg to the starting position.","Attach the band around your ankle. Stand with feet hip-width apart, feet facing forward, and hands on hips., Lift your right leg away from your body to the side, keeping your knee straight. This is your starting position., Maintaining proper form, move your right leg as far to the side as you can, keeping your left leg planted firmly on the ground. Hold for a second and then return your right leg to the starting position.",N/A,"https://media.musclewiki.com/media/uploads/videos/branded/male-band-hip-abduction-front.mp4#t=0.1, https://media.musclewiki.com/media/uploads/videos/branded/male-band-hip-abduction-side.mp4#t=0.1"
