name,body_group,force,muscle_group,equipment,description,steps,grip,video_link
Dumbbell Overhead Press,Upper Body,Push,Shoulders,Dumbbell,"Start by standing with your feet shoulder-width apart and holding a dumbbell in each hand., Bring the dumbbells to your shoulders, with your palms facing forward and your elbows bent., From this starting position, extend your arms upwards so that the dumbbells are overhead., Make sure to keep your core engaged and your back straight throughout the movement.","Start by standing with your feet shoulder-width apart and holding a dumbbell in each hand., Bring the dumbbells to your shoulders, with your palms facing forward and your elbows bent., From this starting position, extend your arms upwards so that the dumbbells are overhead., Make sure to keep your core engaged and your back straight throughout the movement.",Overhand,"https://media.musclewiki.com/media/uploads/videos/branded/male-dumbbell-overhead-press-front.mp4#t=0.1, https://media.musclewiki.com/media/uploads/videos/branded/male-dumbbell-overhead-press-side.mp4#t=0.1"
Dumbbell Push Press,Upper Body,Push,Shoulders,Dumbbell,"Start by standing with your feet shoulder-width apart and holding a dumbbell in each hand., From this starting position, dip your knees slightly and then quickly extend them as you press the dumbbells upwards., Make sure to keep your core engaged and your back straight throughout the movement., Slowly lower the dumbbells back down to the starting position, and repeat for the desired number of repetitions.","Start by standing with your feet shoulder-width apart and holding a dumbbell in each hand., From this starting position, dip your knees slightly and then quickly extend them as you press the dumbbells upwards., Make sure to keep your core engaged and your back straight throughout the movement., Slowly lower the dumbbells back down to the starting position, and repeat for the desired number of repetitions.",Overhand Neutral,"https://media.musclewiki.com/media/uploads/videos/branded/male-dumbbell-push-press-front.mp4#t=0.1, https://media.musclewiki.com/media/uploads/videos/branded/male-dumbbell-push-press-side.mp4#t=0.1"
Dumbbell Single Arm Arnold Press,Upper Body,Push,Shoulders,Dumbbell,"Start by standing with your feet shoulder-width apart and holding a dumbbell in one hand., Bring the dumbbell to your shoulder, with your palm facing you and your elbow bent., From this starting position, extend your arm upwards so that the dumbbell is directly above your head., As you extend your arm, rotate your palm to face away from your body.","Start by standing with your feet shoulder-width apart and holding a dumbbell in one hand., Bring the dumbbell to your shoulder, with your palm facing you and your elbow bent., From this starting position, extend your arm upwards so that the dumbbell is directly above your head., As you extend your arm, rotate your palm to face away from your body.",Rotating,"https://media.musclewiki.com/media/uploads/videos/branded/male-dumbbell-single-arm-arnold-press-front.mp4#t=0.1, https://media.musclewiki.com/media/uploads/videos/branded/male-dumbbell-single-arm-arnold-press-side.mp4#t=0.1"
Dumbbell Single Arm Neutral Overhead Press,Upper Body,Push,Shoulders,Dumbbell,"Start by standing with your feet shoulder-width apart and holding a dumbbell in one hand., Bring the dumbbell to your shoulder, with your palm facing your body and your elbow bent., From this starting position, press the dumbbell upwards so that it is directly above your shoulder.","Start by standing with your feet shoulder-width apart and holding a dumbbell in one hand., Bring the dumbbell to your shoulder, with your palm facing your body and your elbow bent., From this starting position, press the dumbbell upwards so that it is directly above your shoulder.",Neutral,"https://media.musclewiki.com/media/uploads/videos/branded/male-dumbbell-single-arm-neutral-overhead-press-front.mp4#t=0.1, https://media.musclewiki.com/media/uploads/videos/branded/male-dumbbell-single-arm-neutral-overhead-press-side.mp4#t=0.1"
Dumbbell Single Arm Overhead Press,Upper Body,Push,Shoulders,Dumbbell,"Start by standing with your feet shoulder-width apart and holding a dumbbell in one hand., Bring the dumbbell to your shoulder, with your palm facing forward and your elbow bent., From this starting position, extend your arm upwards so that the dumbbell is overhead., Make sure to keep your core engaged and your back straight throughout the movement.","Start by standing with your feet shoulder-width apart and holding a dumbbell in one hand., Bring the dumbbell to your shoulder, with your palm facing forward and your elbow bent., From this starting position, extend your arm upwards so that the dumbbell is overhead., Make sure to keep your core engaged and your back straight throughout the movement.",Overhand,"https://media.musclewiki.com/media/uploads/videos/branded/male-dumbbell-single-arm-overhead-press-front.mp4#t=0.1, https://media.musclewiki.com/media/uploads/videos/branded/male-dumbbell-single-arm-overhead-press-side.mp4#t=0.1"
Child Pose Elbows On Block,Upper Body,Hold,Arms,Yoga,"Place two blocks on the floor, shoulder-width apart., Kneel in front of the blocks, and lower your torso down so that your elbows are resting on the blocks, and your forehead is resting on the floor., Relax your arms, shoulders, and neck, and breathe deeply., Hold for a few breaths, then release.","Place two blocks on the floor, shoulder-width apart., Kneel in front of the blocks, and lower your torso down so that your elbows are resting on the blocks, and your forehead is resting on the floor., Relax your arms, shoulders, and neck, and breathe deeply., Hold for a few breaths, then release.",N/A,"https://media.musclewiki.com/media/uploads/videos/branded/male-yoga-child-pose-elbows-on-block-front.mp4#t=0.1, https://media.musclewiki.com/media/uploads/videos/branded/male-yoga-child-pose-elbows-on-block-side.mp4#t=0.1"
One Arm Cow Face Pose,Upper Body,Hold,Arms,Yoga,"Sit on the floor with your legs extended in front of you., Bend your left knee and place your left foot on the floor, close to your right hip., Cross your right leg over your left leg, stacking your knees on top of each other., Bring your left arm up overhead, and bend your elbow so that your left hand reaches towards your upper back. Reach your right hand behind your back and try to clasp your left hand. Hold","Sit on the floor with your legs extended in front of you., Bend your left knee and place your left foot on the floor, close to your right hip., Cross your right leg over your left leg, stacking your knees on top of each other., Bring your left arm up overhead, and bend your elbow so that your left hand reaches towards your upper back. Reach your right hand behind your back and try to clasp your left hand. Hold",N/A,"https://media.musclewiki.com/media/uploads/videos/branded/male-yoga-one-arm-cow-face-pose-front.mp4#t=0.1, https://media.musclewiki.com/media/uploads/videos/branded/male-yoga-one-arm-cow-face-pose-side.mp4#t=0.1"
Pyramid Prayer,Upper Body,Hold,Arms,Yoga,"Stand with your feet hip-width apart and place your hands on a table, chair, or any elevated surface in front of you., Walk your feet back until your torso is parallel to the ground, and your elbows are resting on the surface., Relax your head and neck, and breathe deeply., Hold for a few breaths, then release.","Stand with your feet hip-width apart and place your hands on a table, chair, or any elevated surface in front of you., Walk your feet back until your torso is parallel to the ground, and your elbows are resting on the surface., Relax your head and neck, and breathe deeply., Hold for a few breaths, then release.",N/A,"https://media.musclewiki.com/media/uploads/videos/branded/male-yoga-pyramid-prayer-front.mp4#t=0.1, https://media.musclewiki.com/media/uploads/videos/branded/male-yoga-pyramid-prayer-side.mp4#t=0.1"
Dumbbell Lateral Raise,Upper Body,Unknown,Shoulders,Dumbbell,"Stand up straight with dumbbells at either side, palms facing your hips., Raise your arms on either side with a slight bend in your elbow until they are parallel with the floor. Pause at the top of the motion., Slowly return your arms down to starting position.","Stand up straight with dumbbells at either side, palms facing your hips., Raise your arms on either side with a slight bend in your elbow until they are parallel with the floor. Pause at the top of the motion., Slowly return your arms down to starting position.",N/A,"https://media.musclewiki.com/media/uploads/videos/branded/male-dumbbell-lateral-raise-front.mp4#t=0.1, https://media.musclewiki.com/media/uploads/videos/branded/male-dumbbell-lateral-raise-side.mp4#t=0.1"
Dumbbell Rear Delt Fly,Upper Body,Unknown,Shoulders,Dumbbell,"With dumbbells in either hand, bend your knees with your feet slightly bowed out. Arch your back above your knees, and start with the weights touching in front of your chest., With bent elbows, raise your arms up to shoulder level, pausing at the at the end of the motion., Slowly lower your arms back to starting position.","With dumbbells in either hand, bend your knees with your feet slightly bowed out. Arch your back above your knees, and start with the weights touching in front of your chest., With bent elbows, raise your arms up to shoulder level, pausing at the at the end of the motion., Slowly lower your arms back to starting position.",N/A,"https://media.musclewiki.com/media/uploads/videos/branded/male-dumbbell-rear-delt-fly-front.mp4#t=0.1, https://media.musclewiki.com/media/uploads/videos/branded/male-dumbbell-rear-delt-fly-side.mp4#t=0.1"
Machine Face Pulls,Upper Body,Pull,Shoulders,Machine,"Facing the pulley, pull the weight towards you while keeping your arms parallel to the ground., Pull your hands back to both sides of your head and hold the position., Slowly return weight to starting position. Repeat.","Facing the pulley, pull the weight towards you while keeping your arms parallel to the ground., Pull your hands back to both sides of your head and hold the position., Slowly return weight to starting position. Repeat.",Overhand,"https://media.musclewiki.com/media/uploads/videos/branded/male-machine-face-pull-front_i9CjsBg.mp4#t=0.1, https://media.musclewiki.com/media/uploads/videos/branded/male-machine-face-pull-side_LnzelQG.mp4#t=0.1"
Dumbbell Seated Overhead Press,Upper Body,Push,Shoulders,Dumbbell,"How To Perform The Seated Dumbbell Overhead PressSetupGrab two dumbbells and set up on an incline or seated bench. Make sure your back is pressed all the way into the vertical pad.Flare your elbows out. Your face should be facing the ceiling and your palms facing forward. Also, make sure the dumbbell is set very deeply in your hand so your wrist stays in a strong position for the entire set.Performing Press the dumbbells up toward the ceiling, fully extending your elbows. Do not hyperextend or lockout your elbows as this is dangerous for those joints. The dumbbells should travel in an arclike curve. With the dumbbells converging at the top of the ramp. There's no need to touch the dumbbells together at the top, but there's nothing wrong if they do.After extending your elbows, begin the eccentric portion of the rep. Make sure your upper arm at least reaches parallel with the ground before initiating the next concentric. If you have the shoulder mobility, you can go all the way to the point the dumbbells tap your shoulders. This may give people with shoulder issues some pain. If it does, cut the range of motion a little shorter.Make sure your back stays flat against the vertical pad for the entire set. There is a tendency to begin extending the spine when fatiguing on an overhead press. Your nervous system understands that you are stronger pushing horizontally than you are pushing vertically. And so it will begin to point your chest up toward the ceiling to try to involve your pecs. Don't let this happen. A hyperextended spine with a weight pushing straight down from overhead will place a lot of unneeded stress on your lumbar spine.","Sit on a bench with back support. Raise the dumbbells to shoulder height with your palms forward., Raise the dumbbells upwards and pause at the contracted position., Lower the weights back to starting position.",Overhand,"https://media.musclewiki.com/media/uploads/videos/branded/male-dumbbell-seated-overhead-press-front.mp4#t=0.1, https://media.musclewiki.com/media/uploads/videos/branded/male-dumbbell-seated-overhead-press-side.mp4#t=0.1"
Dumbbell Front Raise,Upper Body,Push,Shoulders,Dumbbell,"Grab two dumbbells while standing upright with the dumbbells at your side., Raise the two dumbbells with your elbows being fully extended until the dumbbells are eye level., Lower the weights in a controlled manner to the starting position and repeat.","Grab two dumbbells while standing upright with the dumbbells at your side., Raise the two dumbbells with your elbows being fully extended until the dumbbells are eye level., Lower the weights in a controlled manner to the starting position and repeat.",Overhand,"https://media.musclewiki.com/media/uploads/videos/branded/male-dumbbell-front-raise-front.mp4#t=0.1, https://media.musclewiki.com/media/uploads/videos/branded/male-dumbbell-front-raise-side.mp4#t=0.1"
Dumbbell Seated Rear Delt Fly,Upper Body,Unknown,Shoulders,Dumbbell,"With dumbbells in either hand, bend your knees with your feet slightly bowed out. Arch your back above your knees, and start with the weights touching in front of your chest., With bent elbows, raise your arms up to shoulder level, pausing at the at the end of the motion., Slowly lower your arms back to starting position.","With dumbbells in either hand, bend your knees with your feet slightly bowed out. Arch your back above your knees, and start with the weights touching in front of your chest., With bent elbows, raise your arms up to shoulder level, pausing at the at the end of the motion., Slowly lower your arms back to starting position.",N/A,"https://media.musclewiki.com/media/uploads/videos/branded/male-dumbbell-seated-rear-delt-fly-front.mp4#t=0.1, https://media.musclewiki.com/media/uploads/videos/branded/male-dumbbell-seated-rear-delt-fly-side.mp4#t=0.1"
Kettlebell Rear Delt Row,Upper Body,Unknown,Shoulders,Kettlebell,"Stand with your feet shoulder width apart, holding the kettlebell with both hands in front of your thighs., Bend forward at the hips bringing the kettlebell to the floor while you slightly bend your knees, keeping your back straight., Lift the kettlebell upwards towards your upper chest and then lower the kettlebell- repeat.","Stand with your feet shoulder width apart, holding the kettlebell with both hands in front of your thighs., Bend forward at the hips bringing the kettlebell to the floor while you slightly bend your knees, keeping your back straight., Lift the kettlebell upwards towards your upper chest and then lower the kettlebell- repeat.",N/A,"https://media.musclewiki.com/media/uploads/videos/branded/male-kettlebell-rear-delt-row-front.mp4#t=0.1, https://media.musclewiki.com/media/uploads/videos/branded/male-kettlebell-rear-delt-row-side.mp4#t=0.1"
Kettlebell Front Raise,Upper Body,Unknown,Shoulders,Kettlebell,"Stand up straight with feet shoulder width apart, holding the kettlebell in front of your pelvis., Keeping arms straight, raise the kettlebell slightly higher than head level., Return to the starting position and repeat.","Stand up straight with feet shoulder width apart, holding the kettlebell in front of your pelvis., Keeping arms straight, raise the kettlebell slightly higher than head level., Return to the starting position and repeat.",N/A,"https://media.musclewiki.com/media/uploads/videos/branded/male-kettlebell-frontraise-front.mp4#t=0.1, https://media.musclewiki.com/media/uploads/videos/branded/male-kettlebell-frontraise-side.mp4#t=0.1"
Kettlebell Single Arm Rear Delt Fly,Upper Body,Unknown,Shoulders,Kettlebell,"Stand with your feet shoulder width apart holding the kettlebell with both hands in front of your thighs., Bend forward at the hips bringing the kettlebell to the floor while you slightly bend your knees, keeping your back straight., Bring one arm behind you and rest this arm on your back. With the other arm, hold the kettlebell at arms length close to the floor., Swing the kettlebell out and up towards the side of your body and then return to centre. Repeat.","Stand with your feet shoulder width apart holding the kettlebell with both hands in front of your thighs., Bend forward at the hips bringing the kettlebell to the floor while you slightly bend your knees, keeping your back straight., Bring one arm behind you and rest this arm on your back. With the other arm, hold the kettlebell at arms length close to the floor., Swing the kettlebell out and up towards the side of your body and then return to centre. Repeat.",N/A,"https://media.musclewiki.com/media/uploads/videos/branded/male-kettlebell-single-arm-rear-delt-fly-front.mp4#t=0.1, https://media.musclewiki.com/media/uploads/videos/branded/male-kettlebell-single-arm-rear-delt-fly-side.mp4#t=0.1"
Kettlebell Long Lever Lateral Raise,Upper Body,Unknown,Shoulders,Kettlebell,"Stand with feet shoulder width apart holding a kettlebell with one hand at your side., Keeping your arm straight, swing the kettlebell up and out, away from your body to around head height, holding on to the kettlebell firmly so it does not change position in your hand., Return to the starting position and repeat.","Stand with feet shoulder width apart holding a kettlebell with one hand at your side., Keeping your arm straight, swing the kettlebell up and out, away from your body to around head height, holding on to the kettlebell firmly so it does not change position in your hand., Return to the starting position and repeat.",N/A,"https://media.musclewiki.com/media/uploads/videos/branded/male-kettlebell-long-lever-lateral-raise-front.mp4#t=0.1, https://media.musclewiki.com/media/uploads/videos/branded/male-kettlebell-long-lever-lateral-raise-side.mp4#t=0.1"
Kettlebell Single Arm Lateral Raise,Upper Body,Unknown,Shoulders,Kettlebell,"Stand with feet shoulder width apart holding a kettlebell with one hand at your side., Keeping your arm straight, swing the kettlebell up and out, away from your body to around head height., Return to the starting position and repeat.","Stand with feet shoulder width apart holding a kettlebell with one hand at your side., Keeping your arm straight, swing the kettlebell up and out, away from your body to around head height., Return to the starting position and repeat.",N/A,"https://media.musclewiki.com/media/uploads/videos/branded/male-kettlebell-single-arm-lateral-raise-front.mp4#t=0.1, https://media.musclewiki.com/media/uploads/videos/branded/male-kettlebell-single-arm-lateral-raise-side.mp4#t=0.1"
Shoulders Stretch Variation Four,Upper Body,Unknown,Shoulders,Stretches,"Stand with you feet shoulder width apart. Place one arm across the front of your chest at shoulder height, press the forearm of your other arm above the elbow, hooking the stretching arm with your hand., Press the arm until it is straight and rotate your upper torso to engage the stretch even deeper., Repeat with your other arm.","Stand with you feet shoulder width apart. Place one arm across the front of your chest at shoulder height, press the forearm of your other arm above the elbow, hooking the stretching arm with your hand., Press the arm until it is straight and rotate your upper torso to engage the stretch even deeper., Repeat with your other arm.",N/A,"https://media.musclewiki.com/media/uploads/videos/branded/female-shoulders-stretch-variation-4-front.mp4#t=0.1, https://media.musclewiki.com/media/uploads/videos/branded/female-shoulders-stretch-variation-4-side.mp4#t=0.1"
Shoulders Stretch Variation Three,Upper Body,Unknown,Shoulders,Stretches,"Place the top of your hand into the small of your back, your arm at a 90 degree angle., Hold your elbow with the other arm, and slowly pull the arm forward until you feel your shoulder engaged in the stretch. Pause at the apex of the stretch and return to the starting position., Return to starting position, and repeat with your other arm.","Place the top of your hand into the small of your back, your arm at a 90 degree angle., Hold your elbow with the other arm, and slowly pull the arm forward until you feel your shoulder engaged in the stretch. Pause at the apex of the stretch and return to the starting position., Return to starting position, and repeat with your other arm.",N/A,"https://media.musclewiki.com/media/uploads/videos/branded/male-shoulders-stretch-variation-3-front.mp4#t=0.1, https://media.musclewiki.com/media/uploads/videos/branded/male-shoulders-stretch-variation-3-side.mp4#t=0.1"
Shoulders Stretch Variation Two,Upper Body,Unknown,Shoulders,Stretches,"Start with your arms at either side. Begin by pushing your shoulders forward and in towards your chest., Repeat as necessary., Continue the circular motion with your shoulders, pinching up towards your ears, and then extending your chest outwards while you finish the motion.","Start with your arms at either side. Begin by pushing your shoulders forward and in towards your chest., Repeat as necessary., Continue the circular motion with your shoulders, pinching up towards your ears, and then extending your chest outwards while you finish the motion.",N/A,"https://media.musclewiki.com/media/uploads/videos/branded/male-shoulders-stretch-variation-2-front.mp4#t=0.1, https://media.musclewiki.com/media/uploads/videos/branded/male-shoulders-stretch-variation-2-side.mp4#t=0.1"
Shoulders Stretch Variation One,Upper Body,Unknown,Shoulders,Stretches,"Reach one arm behind your body, with your elbow pointing upward behind your head., Assist the stretch with your other hand on your elbow to engage your shoulder., Pause for a few seconds, then repeat the stretch with your other arm.","Reach one arm behind your body, with your elbow pointing upward behind your head., Assist the stretch with your other hand on your elbow to engage your shoulder., Pause for a few seconds, then repeat the stretch with your other arm.",N/A,"https://media.musclewiki.com/media/uploads/videos/branded/male-shoulders-stretch-variation-1-front.mp4#t=0.1, https://media.musclewiki.com/media/uploads/videos/branded/male-shoulders-stretch-variation-1-side.mp4#t=0.1"
Cable Overhead Press,Upper Body,Unknown,Shoulders,Cable,"Use a handle attachment with the cable set to the bottom of the machine. Stand upright making sure to maintain a flat back. Your starting position will have your palms facing forward., Use both your elbows and shoulders to press the weight directly overhead.","Use a handle attachment with the cable set to the bottom of the machine. Stand upright making sure to maintain a flat back. Your starting position will have your palms facing forward., Use both your elbows and shoulders to press the weight directly overhead.",N/A,"https://media.musclewiki.com/media/uploads/videos/branded/male-cable-overhead-press-front.mp4#t=0.1, https://media.musclewiki.com/media/uploads/videos/branded/male-cable-overhead-press-side.mp4#t=0.1"
Cable Lateral Raise,Upper Body,Push,Shoulders,Cable,"Use a handle attachment with the cable set all the way to the bottom of the machine., You should vertically abduct at the shoulder raising your arm straight out to the side., Raise until your arm is parallel with the ground and then back to the starting position.","Use a handle attachment with the cable set all the way to the bottom of the machine., You should vertically abduct at the shoulder raising your arm straight out to the side., Raise until your arm is parallel with the ground and then back to the starting position.",Neutral,"https://media.musclewiki.com/media/uploads/videos/branded/male-cable-lateral-raise-front.mp4#t=0.1, https://media.musclewiki.com/media/uploads/videos/branded/male-cable-lateral-raise-side.mp4#t=0.1"
Cable Rear Delt Fly,Upper Body,Unknown,Shoulders,Cable,"Use a handle attachment or no attachment at all. The cable should be set to the top., Walk a few steps away with the cable coming from the opposing side of the working arm., From there, your shoulders should horizontally abduct and adduct, while your elbows stay in a fixed position.","Use a handle attachment or no attachment at all. The cable should be set to the top., Walk a few steps away with the cable coming from the opposing side of the working arm., From there, your shoulders should horizontally abduct and adduct, while your elbows stay in a fixed position.",Neutral,"https://media.musclewiki.com/media/uploads/videos/branded/male-cable-rear-delt-fly-front.mp4#t=0.1, https://media.musclewiki.com/media/uploads/videos/branded/male-cable-rear-delt-fly-side.mp4#t=0.1"
Band Face Pull,Upper Body,Unknown,Shoulders,Band,"Anchor the band at eye level. Take a few steps away until the band is taut., Use an overhand grip with both hands. Pull the band to the bridge of your nose flaring your elbows out.","Anchor the band at eye level. Take a few steps away until the band is taut., Use an overhand grip with both hands. Pull the band to the bridge of your nose flaring your elbows out.",N/A,"https://media.musclewiki.com/media/uploads/videos/branded/male-band-face-pull-front.mp4#t=0.1, https://media.musclewiki.com/media/uploads/videos/branded/male-band-face-pull-side.mp4#t=0.1"
