name,body_group,force,muscle_group,equipment,description,steps,grip,video_link
Barbell Curl,Upper Body,Pull,Arms,Barbell,"Detailed How To: Grab the barbell with a shoulder width, underhand grip. Flex at the elbows until your forearms press into your bicep (this will look different from person to person). Begin to extend your elbows and control the weight during the eccentric part of the exercise. Make sure to fully extend your elbows at the end of the rep. Repeat until you hit muscular fatigue (13 reps left in the tank)Ty's TipsOne of the drawbacks with a Barbell Curl is the bar limits Range of Motion somewhat. The bar will hit your legs before you can fully extend your arms. On most exercises, we want the longest Range or Motion possible. To remedy this,Push your butt back a tad bit. This will give you a little more room to fully extend your elbows.Watch out for cheating. Using momentum often naturally happens with a Barbell Curl (and most Dumbbell curl variations). There is a move called the Cheat Curl popularized by Arnold himself. But consider that a separate exercise.Root your feet to the floor and use a mirror to watch your form. If your hips begin moving and you're unable to continue to perform reps without any hip movement, end the set.A 612 rep range works well for this exercise.","While holding the upper arms stationary, curl the weights forward while contracting the biceps as you breathe out., Continue the movement until your biceps are fully contracted and the bar is at shoulder level., Hold the contracted position for a second and squeeze the biceps hard., Slowly bring the weight back down to the starting position.",Underhand,"https://media.musclewiki.com/media/uploads/videos/branded/male-barbell-curl-front.mp4#t=0.1, https://media.musclewiki.com/media/uploads/videos/branded/male-barbell-curl-side.mp4#t=0.1"
Dumbbell Curl,Upper Body,Pull,Arms,Dumbbell,"How To Perform the Dumbbell Bicep CurlSetupGrab two dumbbells and stand tall with your shoulder blades pulled back and your chest poked out. You can start with either the dumbbells in front of your quads or off to the sides of your legs. Whichever is more comfortable. Also, whichever will allow you to fully extend your elbows at the bottom of each rep.Use a shoulder width or slightly inside of shoulder width stance. Performing Begin the rep by flexing your elbows. Try to touch your forearms to your biceps at the very top of the movement. Then begin the eccentric. Make sure to fully extend your elbows at the bottom of each rep so you get a full range of motion. It is easy to use momentum on a bicep curl. We want our muscles and not momentum to do the work. So make sure you keep these strict. If you find yourself swinging the weight up, then your biceps have hit fatigue and it's time to end the set.","Stand up straight with a dumbbell in each hand at arms length., Raise one dumbbell and twist your forearm until it is vertical and your palm faces the shoulder., Lower to original position and repeat with opposite arm",Underhand,"https://media.musclewiki.com/media/uploads/videos/branded/male-dumbbell-curl-front.mp4#t=0.1, https://media.musclewiki.com/media/uploads/videos/branded/male-dumbbell-curl-side.mp4#t=0.1"
Dumbbell Hammer Curl,Upper Body,Pull,Arms,Dumbbell,"Hold the dumbbells with a neutral grip (thumbs facing the ceiling)., Slowly lift the dumbbell up to chest height, Return to starting position and repeat.","Hold the dumbbells with a neutral grip (thumbs facing the ceiling)., Slowly lift the dumbbell up to chest height, Return to starting position and repeat.",Neutral,"https://media.musclewiki.com/media/uploads/videos/branded/male-dumbbell-hammer-curl-front.mp4#t=0.1, https://media.musclewiki.com/media/uploads/videos/branded/male-dumbbell-hammer-curl-side.mp4#t=0.1"
Kettlebell Goblet Curl,Upper Body,Pull,Arms,Kettlebell,"Stand up straight with a kettlebell in both hands in front of your pelvis., Raise the kettlebell bending your arms at the elbow until the kettlebell is level with your chest., Lower to the starting position and repeat.","Stand up straight with a kettlebell in both hands in front of your pelvis., Raise the kettlebell bending your arms at the elbow until the kettlebell is level with your chest., Lower to the starting position and repeat.",N/A,"https://media.musclewiki.com/media/uploads/videos/branded/male-kettlebell-goblet-curl-front.mp4#t=0.1, https://media.musclewiki.com/media/uploads/videos/branded/male-kettlebell-goblet-curl-side.mp4#t=0.1"
Kettlebell Concentration Curl,Upper Body,Pull,Arms,Kettlebell,"Sitting on a chair with your legs apart, rest your arm against your thigh and hold the kettlebell with your arm extended towards the floor., Bending your arm at the elbow, lift the kettlebell until your palm faces your shoulder., Lower to the starting position and repeat.","Sitting on a chair with your legs apart, rest your arm against your thigh and hold the kettlebell with your arm extended towards the floor., Bending your arm at the elbow, lift the kettlebell until your palm faces your shoulder., Lower to the starting position and repeat.",Underhand,"https://media.musclewiki.com/media/uploads/videos/branded/male-kettlebell-concentration-curl-front.mp4#t=0.1, https://media.musclewiki.com/media/uploads/videos/branded/male-kettlebell-concentration-curl-side.mp4#t=0.1"
Kettlebell Preacher Curl,Upper Body,Pull,Arms,Kettlebell,"Stand behind a bench, with your chest leaning over the edge of the bench., With one arm resting on the bench, hold the kettlebell, bending the arm at the elbow., Lower your arm using the bench as a guide, keeping your forearm straight., Return to the starting position and repeat.","Stand behind a bench, with your chest leaning over the edge of the bench., With one arm resting on the bench, hold the kettlebell, bending the arm at the elbow., Lower your arm using the bench as a guide, keeping your forearm straight., Return to the starting position and repeat.",Underhand,"https://media.musclewiki.com/media/uploads/videos/branded/male-kettlebell-preacher-curl-front.mp4#t=0.1, https://media.musclewiki.com/media/uploads/videos/branded/male-kettlebell-preacher-curl-side.mp4#t=0.1"
Kettlebell Single Arm Curl,Upper Body,Pull,Arms,Kettlebell,"Stand up straight with a kettlebell in one hand with your forearm facing out., Raise the kettlebell, bending your arm at the elbow and keeping your forearm vertical until your palm faces the shoulder., Lower to the starting position and repeat.","Stand up straight with a kettlebell in one hand with your forearm facing out., Raise the kettlebell, bending your arm at the elbow and keeping your forearm vertical until your palm faces the shoulder., Lower to the starting position and repeat.",N/A,"https://media.musclewiki.com/media/uploads/videos/branded/male-kettlebell-single-arm-curl-front.mp4#t=0.1, https://media.musclewiki.com/media/uploads/videos/branded/male-kettlebell-single-arm-curl-side.mp4#t=0.1"
Biceps Stretch Variation Five,Upper Body,Pull,Arms,Stretches,"Stand upright with your feet shoulder width apart., Raise your arms out to your sides, bringing them up to shoulder level., Rotate your palms so they are facing the ceiling., Then, change direction and rotate the arms as much as you can.","Stand upright with your feet shoulder width apart., Raise your arms out to your sides, bringing them up to shoulder level., Rotate your palms so they are facing the ceiling., Then, change direction and rotate the arms as much as you can.",N/A,"https://media.musclewiki.com/media/uploads/videos/branded/male-biceps-stretch-variation-5-front.mp4#t=0.1, https://media.musclewiki.com/media/uploads/videos/branded/male-biceps-stretch-variation-5-side.mp4#t=0.1"
Biceps Stretch Variation Four,Upper Body,Pull,Arms,Stretches,"Stand an arms width away from the wall., Raise your arms out behind you, and place them on the wall with your fingers pointing up., Bend your knees whilst keeping your hands in the same position.","Stand an arms width away from the wall., Raise your arms out behind you, and place them on the wall with your fingers pointing up., Bend your knees whilst keeping your hands in the same position.",N/A,"https://media.musclewiki.com/media/uploads/videos/branded/male-biceps-stretch-variation-4-front.mp4#t=0.1, https://media.musclewiki.com/media/uploads/videos/branded/male-biceps-stretch-variation-4-side.mp4#t=0.1"
Biceps Stretch Variation Three,Upper Body,Pull,Arms,Stretches,"Bend your arm at the elbow, raising your hand to your shoulder., Using your other hand, stretch the arm down to its full extent.","Bend your arm at the elbow, raising your hand to your shoulder., Using your other hand, stretch the arm down to its full extent.",N/A,"https://media.musclewiki.com/media/uploads/videos/branded/male-biceps-stretch-variation-3-front.mp4#t=0.1, https://media.musclewiki.com/media/uploads/videos/branded/male-biceps-stretch-variation-3-side.mp4#t=0.1"
Biceps Stretch Variation Two,Upper Body,Pull,Arms,Stretches,"Stand facing the wall, an arms width away., Place your hand on the wall with your fingers pointing down., Lean slightly into the wall to feel the stretch in your bicep.","Stand facing the wall, an arms width away., Place your hand on the wall with your fingers pointing down., Lean slightly into the wall to feel the stretch in your bicep.",N/A,"https://media.musclewiki.com/media/uploads/videos/branded/male-biceps-stretch-variation-2-front.mp4#t=0.1, https://media.musclewiki.com/media/uploads/videos/branded/male-biceps-stretch-variation-2-side.mp4#t=0.1"
Biceps Stretch Variation One,Upper Body,Pull,Arms,Stretches,"Stand one foot in front of the other with the wall to your right, an arms width away., Place your hand on the wall, fingers pointing away from you., Gently lean forward, keeping your hand stationary., Repeat with the other arm.","Stand one foot in front of the other with the wall to your right, an arms width away., Place your hand on the wall, fingers pointing away from you., Gently lean forward, keeping your hand stationary., Repeat with the other arm.",N/A,"https://media.musclewiki.com/media/uploads/videos/branded/male-biceps-stretch-variation-1-front.mp4#t=0.1, https://media.musclewiki.com/media/uploads/videos/branded/male-biceps-stretch-variation-1-side.mp4#t=0.1"
Cable Twisting Curl,Upper Body,Pull,Arms,Cable,"Use a handle attachment. The cable should be set all the way to the bottom of the machine., Face away from the cable machine. Stagger your stance so you have a better base of support., Start with a neutral grip. Flex at the elbow. While flexing twist your palm. When you hit the top of the movement your palm should be facing upward.","Use a handle attachment. The cable should be set all the way to the bottom of the machine., Face away from the cable machine. Stagger your stance so you have a better base of support., Start with a neutral grip. Flex at the elbow. While flexing twist your palm. When you hit the top of the movement your palm should be facing upward.",N/A,"https://media.musclewiki.com/media/uploads/videos/branded/male-cable-twisting-curl-front.mp4#t=0.1, https://media.musclewiki.com/media/uploads/videos/branded/male-cable-twisting-curl-side.mp4#t=0.1"
Cable Bayesian Curl,Upper Body,Pull,Arms,Cable,"Use a handle attachment. The cable should be set all the way to the bottom of the machine., Face away from the cable machine., Stagger your stance so you have a better base of support. Face your palm forward. Flex at the elbow and extend.","Use a handle attachment. The cable should be set all the way to the bottom of the machine., Face away from the cable machine., Stagger your stance so you have a better base of support. Face your palm forward. Flex at the elbow and extend.",Underhand,"https://media.musclewiki.com/media/uploads/videos/branded/male-cable-bayesian-curl-front.mp4#t=0.1, https://media.musclewiki.com/media/uploads/videos/branded/male-cable-bayesian-curl-side.mp4#t=0.1"
Cable Reverse Curl,Upper Body,Unknown,Arms,Cable,"Use a handle attachment. The cable should be set all the way to the bottom of the machine., Face away from the cable machine. Stagger your stance so you have a better base of support., Face your palm downwards. Flex at the elbow and extend.","Use a handle attachment. The cable should be set all the way to the bottom of the machine., Face away from the cable machine. Stagger your stance so you have a better base of support., Face your palm downwards. Flex at the elbow and extend.",N/A,"https://media.musclewiki.com/media/uploads/videos/branded/male-cable-reverse-curl-front.mp4#t=0.1, https://media.musclewiki.com/media/uploads/videos/branded/male-cable-reverse-curl-side.mp4#t=0.1"
Cable Hammer Curl,Upper Body,Pull,Arms,Cable,"Use a handle attachment. The cable should be set all the way to the bottom of the machine., Face away from the cable machine. Stagger your stance so you have a better base of support., Use a neutral grip thumb facing up pinky-facing down). Flex at the elbow and extend.","Use a handle attachment. The cable should be set all the way to the bottom of the machine., Face away from the cable machine. Stagger your stance so you have a better base of support., Use a neutral grip thumb facing up pinky-facing down). Flex at the elbow and extend.",Neutral,"https://media.musclewiki.com/media/uploads/videos/branded/male-cable-hammer-curl-front.mp4#t=0.1, https://media.musclewiki.com/media/uploads/videos/branded/male-cable-hammer-curl-side.mp4#t=0.1"
Band Bayesian Curl,Upper Body,Pull,Arms,Band,"Attach band to a low anchor point. Point your palms straight forward., Flex your elbow until you feel your biceps contract. Then fully extend elbows.","Attach band to a low anchor point. Point your palms straight forward., Flex your elbow until you feel your biceps contract. Then fully extend elbows.",N/A,"https://media.musclewiki.com/media/uploads/videos/branded/male-band-curl-front.mp4#t=0.1, https://media.musclewiki.com/media/uploads/videos/branded/male-band-curl-side.mp4#t=0.1"
Band Bayesian Hammer Curl,Upper Body,Unknown,Arms,Band,"Attach band to a low anchor point. Use a neutral grip., Flex your elbow until you feel your biceps contract. Then fully extend elbows.","Attach band to a low anchor point. Use a neutral grip., Flex your elbow until you feel your biceps contract. Then fully extend elbows.",N/A,"https://media.musclewiki.com/media/uploads/videos/branded/male-band-hammer-curl-front.mp4#t=0.1, https://media.musclewiki.com/media/uploads/videos/branded/male-band-hammer-curl-side.mp4#t=0.1"
Band Bayesian Reverse Curl,Upper Body,Unknown,Arms,Band,"Attach band to a low anchor point. . Point your palms toward your thighs., Flex your elbow until you feel your biceps contract. Then fully extend elbows.","Attach band to a low anchor point. . Point your palms toward your thighs., Flex your elbow until you feel your biceps contract. Then fully extend elbows.",N/A,"https://media.musclewiki.com/media/uploads/videos/branded/male-band-reverse-curl-front.mp4#t=0.1, https://media.musclewiki.com/media/uploads/videos/branded/male-band-reverse-curl-side.mp4#t=0.1"
Dumbbell Reverse Curl,Upper Body,Pull,Arms,Dumbbell,"Grab the dumbbells with a pronated (overhand) grip. You can do this exercise thumbless if its more comfortable on your wrists., Flex at the elbows until your biceps touch your forearms. Try not to let your elbows flair outward.","Grab the dumbbells with a pronated (overhand) grip. You can do this exercise thumbless if its more comfortable on your wrists., Flex at the elbows until your biceps touch your forearms. Try not to let your elbows flair outward.",Overhand,"https://media.musclewiki.com/media/uploads/videos/branded/male-dumbbell-reverse-curl-front.mp4#t=0.1, https://media.musclewiki.com/media/uploads/videos/branded/male-dumbbell-reverse-curl-side.mp4#t=0.1"
Barbell Reverse Curl,Upper Body,Pull,Arms,Barbell,"Barbell Reverse Curl: A Comprehensive GuideSetupSelect a barbell with the appropriate weight for your strength levelStand with your feet shoulderwidth apart and grip the barbell with a shoulderwidth overhand gripKeep your arms straight and the barbell hanging at arm's length in front of your thighsHow to PerformBreathe in and tighten your coreCurl the barbell upwards towards your chest, keeping your upper arms stationary and your elbows tucked in close to your torsoHold the contraction at the top for a count of oneLower the barbell back down to the starting position with control, inhaling as you do soRepeat the movement for the desired number of repsTechniqueKeep your movements smooth and controlled throughout the exerciseAvoid using momentum to swing the barbell up and downKeep your head and neck in a neutral position, looking straight ahead and avoiding any unnecessary neck strainEngage your shoulder blades and keep your shoulders down and away from your earsThings to AvoidUsing a weight that is too heavy and sacrificing formArching your back or swaying excessivelyLocking out your elbows at the top of the movementAllowing your elbows to flare out to the sides","Take a double overhand grip thats about shoulder width. Flex your elbows while keeping your elbows tucked in. Try not to let them flare out., Curl until your forearm presses into your bicep. Then fully extend your elbows at the bottom of each rep.",Overhand,"https://media.musclewiki.com/media/uploads/videos/branded/male-barbell-reverse-curl-front.mp4#t=0.1, https://media.musclewiki.com/media/uploads/videos/branded/male-barbell-reverse-curl-side.mp4#t=0.1"
Dumbbell Incline Hammer Curl,Upper Body,Pull,Arms,Dumbbell,"Hold the dumbbells with a neutral grip (thumbs facing the ceiling). Seated on an incline bench., Slowly lift the dumbbell up to chest height, Return to starting position and repeat.","Hold the dumbbells with a neutral grip (thumbs facing the ceiling). Seated on an incline bench., Slowly lift the dumbbell up to chest height, Return to starting position and repeat.",Neutral,"https://media.musclewiki.com/media/uploads/videos/branded/male-dumbbell-incline-hammer-curl-front.mp4#t=0.1, https://media.musclewiki.com/media/uploads/videos/branded/male-dumbbell-incline-hammer-curl-side.mp4#t=0.1"
Dumbbell Incline Reverse Curl,Upper Body,Pull,Arms,Dumbbell,"Lay on an incline bench., Grab the dumbbells with a pronated (overhand) grip. You can do this exercise thumbless if its more comfortable on your wrists., Flex at the elbows until your biceps touch your forearms. Try not to let your elbows flair outward.","Lay on an incline bench., Grab the dumbbells with a pronated (overhand) grip. You can do this exercise thumbless if its more comfortable on your wrists., Flex at the elbows until your biceps touch your forearms. Try not to let your elbows flair outward.",Overhand,"https://media.musclewiki.com/media/uploads/videos/branded/male-dumbbell-incline-reverse-curl-front.mp4#t=0.1, https://media.musclewiki.com/media/uploads/videos/branded/male-dumbbell-incline-reverse-curl-side.mp4#t=0.1"
Dumbbell Incline Zottman Curl,Upper Body,Pull,Arms,Dumbbell,"Lay on an incline bench with your palms facing forward., Flex at the elbows until your forearms touch your biceps., When you hit the top of the movement, rotate your palms and then lower the dumbbells slowly.","Lay on an incline bench with your palms facing forward., Flex at the elbows until your forearms touch your biceps., When you hit the top of the movement, rotate your palms and then lower the dumbbells slowly.",Rotating,"https://media.musclewiki.com/media/uploads/videos/branded/male-dumbbell-incline-zottman-curl-front.mp4#t=0.1, https://media.musclewiki.com/media/uploads/videos/branded/male-dumbbell-incline-zottman-curl-side.mp4#t=0.1"
Dumbbell Single Arm Preacher Curl,Upper Body,Pull,Arms,Dumbbell,"Start with a with a dumbbell in one hand and your elbow resting on the bench., From this starting position, curl the dumbbell up towards your shoulder, keeping your upper arm stationary on the bench.","Start with a with a dumbbell in one hand and your elbow resting on the bench., From this starting position, curl the dumbbell up towards your shoulder, keeping your upper arm stationary on the bench.",Underhand,"https://media.musclewiki.com/media/uploads/videos/branded/male-dumbbell-single-arm-preacher-curl-front.mp4#t=0.1, https://media.musclewiki.com/media/uploads/videos/branded/male-dumbbell-single-arm-preacher-curl-side.mp4#t=0.1"
Dumbbell Single Arm Spider Curl,Upper Body,Pull,Arms,Dumbbell,"Lay on an incline or preacher curl bench., Let your arms hang freely off the edge of the bench., Fully flex your elbow and fully extend your elbow on each rep.","Lay on an incline or preacher curl bench., Let your arms hang freely off the edge of the bench., Fully flex your elbow and fully extend your elbow on each rep.",Underhand,"https://media.musclewiki.com/media/uploads/videos/branded/male-dumbbell-single-arm-spider-curl-front.mp4#t=0.1, https://media.musclewiki.com/media/uploads/videos/branded/male-dumbbell-single-arm-spider-curl-side.mp4#t=0.1"
Dumbbell Spider Curl,Upper Body,Pull,Arms,Dumbbell,"Start by placing your forearms on a flat bench and holding a dumbbell in each hand., From this starting position, curl the dumbbells up towards your shoulders, keeping your elbows close to your body and your core engaged., Slowly lower the dumbbells back down to the starting position, and repeat for the desired number of repetitions.","Start by placing your forearms on a flat bench and holding a dumbbell in each hand., From this starting position, curl the dumbbells up towards your shoulders, keeping your elbows close to your body and your core engaged., Slowly lower the dumbbells back down to the starting position, and repeat for the desired number of repetitions.",Underhand,"https://media.musclewiki.com/media/uploads/videos/branded/male-dumbbell-spider-curl-front.mp4#t=0.1, https://media.musclewiki.com/media/uploads/videos/branded/male-dumbbell-spider-curl-side.mp4#t=0.1"
Dumbbell Twisting Curl,Upper Body,Pull,Arms,Dumbbell,"Start by standing with your feet shoulder-width apart and holding a dumbbell in each hand., Bring the dumbbells to your sides, with your palms facing inward and your elbows bent., From this starting position, curl the dumbbells up towards your shoulders while rotating your wrists so that your palms face your shoulders at the top of the movement.","Start by standing with your feet shoulder-width apart and holding a dumbbell in each hand., Bring the dumbbells to your sides, with your palms facing inward and your elbows bent., From this starting position, curl the dumbbells up towards your shoulders while rotating your wrists so that your palms face your shoulders at the top of the movement.",Rotating,"https://media.musclewiki.com/media/uploads/videos/branded/male-dumbbell-twisting-curl-front.mp4#t=0.1, https://media.musclewiki.com/media/uploads/videos/branded/male-dumbbell-twisting-curl-side.mp4#t=0.1"
Plate Bicep Curl,Upper Body,Pull,Arms,Plate,,,Neutral,"https://media.musclewiki.com/media/uploads/videos/branded/male-plate-bicep-curl-front.mp4#t=0.1, https://media.musclewiki.com/media/uploads/videos/branded/male-plate-bicep-curl-side.mp4#t=0.1"
Plate Curl To Overhead Press,Upper Body,Push,Arms,Plate,"Stand with feet shoulder-width apart and the plate in front of the torso, palms facing forward., Curl the plate up to the front of the shoulder while keeping the elbows close to the body., Rotate the palms to face forward and press the plate overhead, locking out the arms., Lower the plate back to the starting position, keeping control of it, and repeat for desired reps.","Stand with feet shoulder-width apart and the plate in front of the torso, palms facing forward., Curl the plate up to the front of the shoulder while keeping the elbows close to the body., Rotate the palms to face forward and press the plate overhead, locking out the arms., Lower the plate back to the starting position, keeping control of it, and repeat for desired reps.",Neutral,"https://media.musclewiki.com/media/uploads/videos/branded/male-plate-curl-to-overhead-press-front_kQDPle2.mp4#t=0.1, https://media.musclewiki.com/media/uploads/videos/branded/male-plate-curl-to-overhead-press-side.mp4#t=0.1"
Plate Curl To Overhead Press To Tricep Extension,Upper Body,Unknown,Arms,Plate,"Stand with feet shoulder-width apart and the plate in front of the torso, palms facing forward., Curl the plate up to the front of the shoulder while keeping the elbows close to the body., Rotate the palms to face forward and press the plate overhead, locking out the arms., Lower the plate back behind the head to the starting position of a tricep extension., Push the plate back up overhead, then lower it back to the starting position and repeat for desired reps.","Stand with feet shoulder-width apart and the plate in front of the torso, palms facing forward., Curl the plate up to the front of the shoulder while keeping the elbows close to the body., Rotate the palms to face forward and press the plate overhead, locking out the arms., Lower the plate back behind the head to the starting position of a tricep extension., Push the plate back up overhead, then lower it back to the starting position and repeat for desired reps.",Neutral,"https://media.musclewiki.com/media/uploads/videos/branded/male-plate-curl-to-overhead-press-to-tricep-extension-front_LMFCnKf.mp4#t=0.1, https://media.musclewiki.com/media/uploads/videos/branded/male-plate-curl-to-overhead-press-to-tricep-extension-side_ax0yvwM.mp4#t=0.1"
