name,body_group,force,muscle_group,equipment,description,steps,grip,video_link
Dumbbell Goblet Bulgarian Split Squat,Lower Body,Unknown,Legs,Dumbbell,"Holding the dumbbell in a goblet squat place your foot on a bench or box., Break at the hips and knees. Try to go to the point where your hamstring is parallel with the ground. Or until your back knee taps the floor., Make sure to keep your back flat and your elbows directly under your fists.","Holding the dumbbell in a goblet squat place your foot on a bench or box., Break at the hips and knees. Try to go to the point where your hamstring is parallel with the ground. Or until your back knee taps the floor., Make sure to keep your back flat and your elbows directly under your fists.",N/A,"https://media.musclewiki.com/media/uploads/videos/branded/male-dumbbell-goblet-bulgarian-split-squat-front.mp4#t=0.1, https://media.musclewiki.com/media/uploads/videos/branded/male-dumbbell-goblet-bulgarian-split-squat-side.mp4#t=0.1"
Barbell Bulgarian Split Squat,Lower Body,Unknown,Legs,Barbell,"Barbell Bulgarian Split Squat: A Comprehensive GuideSetupStart by positioning a barbell on a squat rack or in a landmine setup.Step under the bar and grasp it with a palmsforward grip, just outside of your hips.Lift the bar from the rack and stand with your feet hipwidth apart and the barbell resting across your upper back.Take a large step forward with your right foot and place your left foot behind you, keeping it on a bench or elevated surface.How to PerformBend your right knee, lowering your torso towards the ground until your left knee almost touches it.Pause, then push through your right heel to return to the starting position.Repeat for the desired number of repetitions, then switch legs and repeat with your left foot forward.TechniqueKeep your chest lifted and your core engaged throughout the exercise.Make sure your front knee stays directly above your ankle and doesn't move forward past your toes.Keep your weight evenly distributed between both feet, and avoid shifting too much weight onto your back foot.Inhale as you lower down and exhale as you push back up to the starting position.Things to AvoidAvoid rounding your lower back or hunching forward as you lower down.Don't allow your front knee to collapse inward.Avoid shifting your weight too far forward onto your front foot, as this can put unnecessary strain on your knee.Don't let your back foot come off the bench or elevated surface during the exercise.","Find a box or bench that is roughly knee height or a few inches lower. (The lower the box is the lower the mobility requirement)., You can either place your toes or the top of your foot on the box. Point your front foot forward or slightly turned outwards and break at the knees and hips simultaneously., Aim to get your front leg to hit parallel depth (hamstring parallel with the ground) or lower., The further forward your front foot is, the longer the Range of Motion is at your hips. The further back your front foot is, the longer the ROM at your knees.",N/A,"https://media.musclewiki.com/media/uploads/videos/branded/male-barbell-bulgarian-split-squat-front.mp4#t=0.1, https://media.musclewiki.com/media/uploads/videos/branded/male-barbell-bulgarian-split-squat-side.mp4#t=0.1"
Barbell Front Squat Olympic,Lower Body,Push,Legs,Barbell,"Measure your hands by the markings on the bar to make sure youre even. Then throw your elbows underneath the bar., The bar should be set so high on your shoulders it digs into your neck a bit. Make sure to push your elbows up to the ceiling for the entire rep. To make sure you dont get too pitched forward., Use the squat stance you would use for a back or goblet squat. Push your hips back to initiate the squat. Break at the knees until you hit parallel depth., Squat back up to a standing position.","Measure your hands by the markings on the bar to make sure youre even. Then throw your elbows underneath the bar., The bar should be set so high on your shoulders it digs into your neck a bit. Make sure to push your elbows up to the ceiling for the entire rep. To make sure you dont get too pitched forward., Use the squat stance you would use for a back or goblet squat. Push your hips back to initiate the squat. Break at the knees until you hit parallel depth., Squat back up to a standing position.",N/A,"https://media.musclewiki.com/media/uploads/videos/branded/male-barbell-front-squat-olympic-front.mp4#t=0.1, https://media.musclewiki.com/media/uploads/videos/branded/male-barbell-front-squat-olympic-side.mp4#t=0.1"
Barbell Front Squat Bodybuilding,Lower Body,Push,Legs,Barbell,"Measure your shoulders against the bar to make sure youre even. Throw your shoulders under the bar. The bar should be digging into your neck slightly., Make sure to push your elbows up to the ceiling for the entire rep. To make sure you dont get too pitched forward., Use the squat stance you would use for a back or goblet squat. Push your hips back to initiate the squat. Break at the knees until you hit parallel depth., Squat back up to a standing position.","Measure your shoulders against the bar to make sure youre even. Throw your shoulders under the bar. The bar should be digging into your neck slightly., Make sure to push your elbows up to the ceiling for the entire rep. To make sure you dont get too pitched forward., Use the squat stance you would use for a back or goblet squat. Push your hips back to initiate the squat. Break at the knees until you hit parallel depth., Squat back up to a standing position.",N/A,"https://media.musclewiki.com/media/uploads/videos/branded/male-barbell-front-squat-bodybuilding-front.mp4#t=0.1, https://media.musclewiki.com/media/uploads/videos/branded/male-barbell-front-squat-bodybuilding-side.mp4#t=0.1"
Barbell High Bar Squat,Lower Body,Push,Legs,Barbell,"Barbell High Bar Squat: A Comprehensive GuideSetupChoose a barbell and weights that are appropriate for your strength level.Place the barbell on a squat rack at shoulder height. Stand facing the barbell with your feet shoulderwidth apart. Grasp the barbell with both hands, positioning your hands slightly wider than shoulderwidth apart.Step under the bar, positioning it on the back of your shoulders, just below the neck. Make sure the bar is securely positioned on your shoulders. Take a deep breath and tighten your core muscles.How to Perform Begin by bending at the hips and knees, lowering your body down towards the ground. Keep your chest lifted and your back straight, making sure not to round your back at any point. Continue to lower your body until your thighs are parallel to the ground. Push through your heels to straighten your legs, returning to the starting position. Repeat for the desired number of repetitions.Technique Keep your core engaged and your back straight throughout the entire exercise. Make sure to keep your weight balanced evenly on both feet. Focus on pushing through your heels, rather than your toes, when returning to the starting position. Avoid allowing your knees to cave inwards, keep them aligned with your second toe.Things to Avoid Rounding your back or allowing your chest to drop during the exercise. Allowing your knees to cave inwards. Using weights that are too heavy, leading to improper form or injury. Not engaging your core throughout the exercise.","Place the bar on top of your traps., Push your hips back and break at the knees. Push your elbows forward to keep yourself from getting pitched too far forward., Aim to get your hamstrings to parallel with the floor., Push your heels into the floor and squat back to a standing position.",N/A,"https://media.musclewiki.com/media/uploads/videos/branded/male-barbell-highbar-squat-front_b7zW1qG.mp4#t=0.1, https://media.musclewiki.com/media/uploads/videos/branded/male-barbell-highbar-squat-side.mp4#t=0.1"
Barbell Low Bar Squat,Lower Body,Unknown,Legs,Barbell,"Barbell Low Bar Squat: A Comprehensive GuideSetupSet the barbell at the appropriate height, usually around hip level, on a squat rack.Place your feet shoulderwidth apart with toes pointing slightly outwards.Grasp the bar with both hands, palms facing forward and slightly wider than shoulderwidth apart.Lift the bar off the squat rack and step back, maintaining a neutral spine.How to PerformLower your body by bending at the hips and knees while keeping your weight on your heels.Go down as low as you can while keeping your heels on the ground and your back straight.Push up through your heels, returning to the starting position.Repeat for the desired number of reps.TechniqueKeep your chest up and maintain a neutral spine throughout the movement.Ensure that your knees stay aligned with your toes, not caving inwards or outwards.Make sure that the bar stays centered over your midfoot throughout the movement.Breathe in as you descend and breathe out as you rise back to the starting position.Things to AvoidRounding your lower back or having an excessive arch in your back.Allowing your knees to cave inwards or outwards.Letting your heels come off the ground.Bouncing out of the bottom of the squat or using momentum to complete the movement.","Pull your shoulder blades back really hard and place the bar on your posterior delts., Push your hips back and break at the knees to initiate the squat., Aim to get your hamstrings to parallel with the ground. Push your heels into the floor and squat back up to a standing position.",N/A,"https://media.musclewiki.com/media/uploads/videos/branded/male-barbell-lowbar-squat-front.mp4#t=0.1, https://media.musclewiki.com/media/uploads/videos/branded/male-barbell-lowbar-squat-side.mp4#t=0.1"
Dumbbell Bulgarian Split Squat,Lower Body,Push,Legs,Dumbbell,"Find a box or bench that is roughly knee height or a few inches lower. (The lower the box is the lower the mobility requirement)., You can either place your toes or the top of your foot on the box. Point your front foot forward or slightly turned outwards and break at the knees and hips simultaneously., Aim to get your front leg to hit parallel depth (hamstring parallel with the ground) or lower., The further forward your front foot is, the longer the Range of Motion is at your hips. The further back your front foot is, the longer the ROM at your knees.","Find a box or bench that is roughly knee height or a few inches lower. (The lower the box is the lower the mobility requirement)., You can either place your toes or the top of your foot on the box. Point your front foot forward or slightly turned outwards and break at the knees and hips simultaneously., Aim to get your front leg to hit parallel depth (hamstring parallel with the ground) or lower., The further forward your front foot is, the longer the Range of Motion is at your hips. The further back your front foot is, the longer the ROM at your knees.",Neutral,"https://media.musclewiki.com/media/uploads/videos/branded/male-dumbbell-bulgarian-split-squat-front.mp4#t=0.1, https://media.musclewiki.com/media/uploads/videos/branded/male-dumbbell-bulgarian-split-squat-side.mp4#t=0.1"
Barbell Coan Deadlift,Lower Body,Unknown,Legs,Barbell,"Stand with your feet hip-width apart and place a barbell on the floor in front of you., Bend at the hips and knees to grasp the barbell with an overhand grip, positioning your hands just outside of your hips., Keeping your back straight and your core engaged, lift the barbell off the floor by extending your hips and knees., As you lift the barbell, pull your shoulders back and squeeze your glutes to fully extend your hips at the top of the movement.","Stand with your feet hip-width apart and place a barbell on the floor in front of you., Bend at the hips and knees to grasp the barbell with an overhand grip, positioning your hands just outside of your hips., Keeping your back straight and your core engaged, lift the barbell off the floor by extending your hips and knees., As you lift the barbell, pull your shoulders back and squeeze your glutes to fully extend your hips at the top of the movement.",Overhand Mixed,"https://media.musclewiki.com/media/uploads/videos/branded/male-barbell-coan-deadlift-front.mp4#t=0.1, https://media.musclewiki.com/media/uploads/videos/branded/male-barbell-coan-deadlift-side.mp4#t=0.1"
Barbell Forward Lunge,Lower Body,Push,Legs,Barbell,"Stand with your feet shoulder-width apart and hold a barbell at your shoulders with an overhand grip., Step forward with your right foot and bend both knees to lower your body until your right thigh is parallel to the ground., Push off your right foot to return to the starting position.","Stand with your feet shoulder-width apart and hold a barbell at your shoulders with an overhand grip., Step forward with your right foot and bend both knees to lower your body until your right thigh is parallel to the ground., Push off your right foot to return to the starting position.",Overhand,"https://media.musclewiki.com/media/uploads/videos/branded/male-barbell-forward-lunge-front.mp4#t=0.1, https://media.musclewiki.com/media/uploads/videos/branded/male-barbell-forward-lunge-side.mp4#t=0.1"
Barbell Front Rack Step Up,Lower Body,Push,Legs,Barbell,"Stand in front of a step or bench with your feet shoulder-width apart and hold a barbell at your shoulders with an overhand grip., Step up onto the bench with your right foot, pushing off your foot to raise your body up onto the bench., Bring your left foot up onto the bench and stand up straight, keeping the barbell at your shoulders., Step back down with your left foot, followed by your right foot, to return to the starting position.","Stand in front of a step or bench with your feet shoulder-width apart and hold a barbell at your shoulders with an overhand grip., Step up onto the bench with your right foot, pushing off your foot to raise your body up onto the bench., Bring your left foot up onto the bench and stand up straight, keeping the barbell at your shoulders., Step back down with your left foot, followed by your right foot, to return to the starting position.",N/A,"https://media.musclewiki.com/media/uploads/videos/branded/male-barbell-front-rack-step-up-front.mp4#t=0.1, https://media.musclewiki.com/media/uploads/videos/branded/male-barbell-front-rack-step-up-side.mp4#t=0.1"
Barbell Heels Up Back Squat,Lower Body,Push,Legs,Barbell,"Stand with your feet shoulder-width apart and your heels on a plate or low step., Bend your knees and lower your body into a squat position., Push through your heels to return to the starting position.","Stand with your feet shoulder-width apart and your heels on a plate or low step., Bend your knees and lower your body into a squat position., Push through your heels to return to the starting position.",Overhand,"https://media.musclewiki.com/media/uploads/videos/branded/male-barbell-heels-up-back-squat-front.mp4#t=0.1, https://media.musclewiki.com/media/uploads/videos/branded/male-barbell-heels-up-back-squat-side.mp4#t=0.1"
Barbell Heels Up Front Squat,Lower Body,Push,Legs,Barbell,"Stand with your feet shoulder-width apart and feet on a plate. Place the bar in a front rack position., Bend your knees and lower your body into a squat position, keeping your heels raised off the ground., Push through your heels to return to the starting position.","Stand with your feet shoulder-width apart and feet on a plate. Place the bar in a front rack position., Bend your knees and lower your body into a squat position, keeping your heels raised off the ground., Push through your heels to return to the starting position.",N/A,"https://media.musclewiki.com/media/uploads/videos/branded/male-barbell-heels-up-front-squat-front.mp4#t=0.1, https://media.musclewiki.com/media/uploads/videos/branded/male-barbell-heels-up-front-squat-side.mp4#t=0.1"
Barbell Lateral Lunge,Lower Body,Push,Legs,Barbell,"Stand with your feet shoulder-width apart and hold a barbell at your shoulders with an overhand grip., Step out to the side with your right foot and bend your right knee to lower your body until your right thigh is parallel to the ground., Push off your right foot to return to the starting position., Repeat on the opposite side by stepping out with your left foot.","Stand with your feet shoulder-width apart and hold a barbell at your shoulders with an overhand grip., Step out to the side with your right foot and bend your right knee to lower your body until your right thigh is parallel to the ground., Push off your right foot to return to the starting position., Repeat on the opposite side by stepping out with your left foot.",Overhand,"https://media.musclewiki.com/media/uploads/videos/branded/male-barbell-lateral-lunge-front.mp4#t=0.1, https://media.musclewiki.com/media/uploads/videos/branded/male-barbell-lateral-lunge-side.mp4#t=0.1"
Barbell Pause Box Squat,Lower Body,Push,Legs,Barbell,"Stand in front of a box or bench with your feet shoulder-width apart and a barbell resting on your upper back., Lower your body into a squat position, sitting back onto the box and pausing for a moment before standing back up., Push through your heels to return to the standing position.","Stand in front of a box or bench with your feet shoulder-width apart and a barbell resting on your upper back., Lower your body into a squat position, sitting back onto the box and pausing for a moment before standing back up., Push through your heels to return to the standing position.",Overhand,"https://media.musclewiki.com/media/uploads/videos/branded/male-barbell-pause-box-squat-front.mp4#t=0.1, https://media.musclewiki.com/media/uploads/videos/branded/male-barbell-pause-box-squat-side.mp4#t=0.1"
Barbell Pause Squat,Lower Body,Push,Legs,Barbell,"Stand with your feet shoulder-width apart and a barbell resting on your upper back., Lower your body into a squat position, pausing for a moment at the bottom of the movement before standing back up., Push through your heels to return to the standing position.","Stand with your feet shoulder-width apart and a barbell resting on your upper back., Lower your body into a squat position, pausing for a moment at the bottom of the movement before standing back up., Push through your heels to return to the standing position.",Overhand,"https://media.musclewiki.com/media/uploads/videos/branded/male-barbell-pause-box-squat-front_GEhqEjs.mp4#t=0.1, https://media.musclewiki.com/media/uploads/videos/branded/male-barbell-pause-box-squat-side_2PFhPFu.mp4#t=0.1"
Barbell Reverse Deadlift,Lower Body,Push,Legs,Barbell,"Start by standing with your feet about hip-width apart, with your toes pointed slightly outward., Place a barbell on the floor behind you, with the weight plates on either side., Bend down and grab the barbell with an overhand grip, your hands slightly wider than shoulder-width apart. Keep your back straight and your shoulders down as you grip the bar., Stand up straight, lifting the barbell off the ground and pulling it toward your hips. Keep your elbows close to your body and your shoulders down as you do this.","Start by standing with your feet about hip-width apart, with your toes pointed slightly outward., Place a barbell on the floor behind you, with the weight plates on either side., Bend down and grab the barbell with an overhand grip, your hands slightly wider than shoulder-width apart. Keep your back straight and your shoulders down as you grip the bar., Stand up straight, lifting the barbell off the ground and pulling it toward your hips. Keep your elbows close to your body and your shoulders down as you do this.",Overhand Underhand,"https://media.musclewiki.com/media/uploads/videos/branded/male-barbell-reverse-deadlift-front.mp4#t=0.1, https://media.musclewiki.com/media/uploads/videos/branded/male-barbell-reverse-deadlift-side.mp4#t=0.1"
Barbell Reverse Lunge,Lower Body,Push,Legs,Barbell,"Start by standing with your feet about hip-width apart, with a barbell on your shoulders. Your feet should be slightly pointed outward, and your shoulders should be down and relaxed., Step backward with one foot, lowering your body until your front thigh is parallel to the ground and your back knee is hovering just above the ground., Push off your back foot, returning to the starting position.","Start by standing with your feet about hip-width apart, with a barbell on your shoulders. Your feet should be slightly pointed outward, and your shoulders should be down and relaxed., Step backward with one foot, lowering your body until your front thigh is parallel to the ground and your back knee is hovering just above the ground., Push off your back foot, returning to the starting position.",Overhand,"https://media.musclewiki.com/media/uploads/videos/branded/male-barbell-reverse-lunge-front.mp4#t=0.1, https://media.musclewiki.com/media/uploads/videos/branded/male-barbell-reverse-lunge-side.mp4#t=0.1"
Bodyweight Reverse Step Up,Lower Body,Push,Legs,Bodyweight,"Start with a box or bench behind you and one of your feet on the box/bench., The balls of your feet should be planted on the box/bench., Drive through the ball of your foot extending your knees until youre upright and standing on the box.","Start with a box or bench behind you and one of your feet on the box/bench., The balls of your feet should be planted on the box/bench., Drive through the ball of your foot extending your knees until youre upright and standing on the box.",N/A,"https://media.musclewiki.com/media/uploads/videos/branded/male-barbell-reverse-step-up-front.mp4#t=0.1, https://media.musclewiki.com/media/uploads/videos/branded/male-bodyweight-reverse-step-up-side.mp4#t=0.1"
Barbell Side Step Up,Lower Body,Push,Legs,Barbell,"Start by standing with your feet about hip-width apart, with a barbell on your shoulders. Your feet should be slightly pointed outward, and your shoulders should be down and relaxed., Place a step or box beside you, and step up onto it with one foot. Your other foot should remain on the ground., Push off your grounded foot, raising your body up onto the step., Step back down with the same foot, returning to the starting position.","Start by standing with your feet about hip-width apart, with a barbell on your shoulders. Your feet should be slightly pointed outward, and your shoulders should be down and relaxed., Place a step or box beside you, and step up onto it with one foot. Your other foot should remain on the ground., Push off your grounded foot, raising your body up onto the step., Step back down with the same foot, returning to the starting position.",Overhand,"https://media.musclewiki.com/media/uploads/videos/branded/male-barbell-side-step-up-front.mp4#t=0.1, https://media.musclewiki.com/media/uploads/videos/branded/male-barbell-side-step-up-side.mp4#t=0.1"
Barbell Split Squat,Lower Body,Push,Legs,Barbell,"Take a large step forward with one leg, and lower your body until your back knee nearly touches the ground. Your front knee should be bent at a 90-degree angle, and your back leg should be straight., Push through the heel of your front foot to raise your body back to the starting position.","Take a large step forward with one leg, and lower your body until your back knee nearly touches the ground. Your front knee should be bent at a 90-degree angle, and your back leg should be straight., Push through the heel of your front foot to raise your body back to the starting position.",Overhand,"https://media.musclewiki.com/media/uploads/videos/branded/male-barbell-split-squat-front.mp4#t=0.1, https://media.musclewiki.com/media/uploads/videos/branded/male-barbell-split-squat-side.mp4#t=0.1"
Barbell Step Up Balance,Lower Body,Push,Legs,Barbell,"Begin by standing in front of a sturdy box or bench that is about knee-height, holding a barbell across your upper back and shoulders, using an overhand grip., Place your right foot on the box and push through the heel to lift your body up and onto the box, keeping your left foot off the ground., Step back down with your right foot, lowering your left foot to the ground.","Begin by standing in front of a sturdy box or bench that is about knee-height, holding a barbell across your upper back and shoulders, using an overhand grip., Place your right foot on the box and push through the heel to lift your body up and onto the box, keeping your left foot off the ground., Step back down with your right foot, lowering your left foot to the ground.",Overhand,"https://media.musclewiki.com/media/uploads/videos/branded/male-barbell-step-up-balance-front.mp4#t=0.1, https://media.musclewiki.com/media/uploads/videos/branded/male-barbell-step-up-balance-side.mp4#t=0.1"
Barbell Step Up,Lower Body,Push,Legs,Barbell,"Begin by standing in front of a sturdy box or bench that is about knee-height, holding a barbell across your upper back and shoulders, using an overhand grip., Place your right foot on the box and push through the heel to lift your body up and onto the box., Step back down with your right foot.","Begin by standing in front of a sturdy box or bench that is about knee-height, holding a barbell across your upper back and shoulders, using an overhand grip., Place your right foot on the box and push through the heel to lift your body up and onto the box., Step back down with your right foot.",Overhand,"https://media.musclewiki.com/media/uploads/videos/branded/male-barbell-step-up-front.mp4#t=0.1, https://media.musclewiki.com/media/uploads/videos/branded/male-barbell-step-up-side.mp4#t=0.1"
